{
  "schema_version": "1.0",
  "benchmark_id": "EVAL-001",
  "submission_id": "replace-me",
  "evidence_mode": "A",
  "candidate": "Dana Edwards",
  "started_at": null,
  "completed_at": null,
  "elapsed_minutes": null,
  "ai_disclosure": {
    "used": true,
    "tools": ["Codex"],
    "uses": ["PENDING: replace with actual uses"],
    "human_reviewed": false,
    "notes": "Template only. Set human_reviewed true only after the relevant AI-assisted output has actually been reviewed."
  },
  "unaided_claims": [],
  "proctor": null,
  "reproduce": [
    "PENDING: replace with a real clean-clone reproduction command"
  ],
  "commit_sha": null,
  "score": null,
  "critical_failures": [],
  "status": "draft",
  "notes": "Template only; not a completed submission and not portfolio evidence."
}
